reports/pearson_correlation.csv

,sepal length (cm),sepal width (cm),petal length (cm),petal width (cm),sepal_area,petal_area
sepal length (cm),1.0,-0.11929333105918447,0.8737381423229723,0.8206195219861115,0.6891423614529404,0.8595878427674055
sepal width (cm),-0.11929333105918447,1.0,-0.4254245320920509,-0.36202950485769825,0.6314835297094727,-0.28278386481623946
petal length (cm),0.8737381423229723,-0.4254245320920509,1.0,0.962772294599787,0.3776841490881609,0.9582592758868517
petal width (cm),0.8206195219861115,-0.36202950485769825,0.962772294599787,1.0,0.38583902798305525,0.9802601522095712
sepal_area,0.6891423614529404,0.6314835297094727,0.3776841490881609,0.38583902798305525,1.0,0.4719427856941061
petal_area,0.8595878427674055,-0.28278386481623946,0.9582592758868517,0.9802601522095712,0.4719427856941061,1.0

reports/week1_report.md

### Strongest Correlations:

1. petal width (cm) <-> petal_area: 0.980 (Very strong positive)
2. petal length (cm) <-> petal width (cm): 0.963 (Very strong positive)
3. petal length (cm) <-> petal_area: 0.958 (Very strong positive)
4. sepal length (cm) <-> petal length (cm): 0.874 (Strong positive)
5. sepal length (cm) <-> petal_area: 0.860 (Strong positive)